<?xml version="1.0" encoding="UTF-8"?>

<!-- <!DOCTYPE orders SYSTEM "order_type.dtd"> -->
<orders xmlns:xsi="http://www.w3.org/2001/XMLSchema-instance"
 xsi:noNamespaceSchemaLocation="order.xsd">
    <order>
        <orderID>101</orderID>
        <name>Pranav</name>
        <phone>9361213492</phone>
        <address>Ettimadai, Coimbatore</address>
        <date>25/08/2022</date>
        <medicines>
            <medicine>
                <medicine_name>Crocin</medicine_name>
                <quantity>3</quantity>
                <discount>10</discount>
            </medicine>
            <medicine>
                <medicine_name>Gelusil</medicine_name>
                <quantity>1</quantity>
                <discount>15</discount>
            </medicine>
        </medicines>
        <amount>500</amount>
    </order>
</orders>